id,class,text
945,no,nem deveria ter contratado
946,no,Esse tem um empresario bom
947,no,Libera rapido antes que os turcos desistam
948,no,Eis que a sorte bate a porta 
949,no,Tem alguem disponivel pra levar no aeroporto
950,yes,Jogando o milho e sentando no sabugo ne maria
951,no,A quanto tempo voces nao disputa uma libertadores
952,no,Pq eles precisam trabalhar 
953,yes,GUILHERME SEU IDIOTA
954,yes,Lurdinha burra
955,no,quando foi isso
956,yes,alo sua vai botar ovos suas fracast 
957,yes,MIERDAS
958,no,Alguem falou em helicoptero
959,no,falou tudo
960,yes,time bosta cai gigante nunca kkkk
961,yes,Com essas contratacoes as frangas vao tomar no oi
962,no,Quem esse time
963,no,Pior cego e o burro
964,no,Se o seu dinheiro for fruto de corrupcao vc devera ser preso sim 
965,yes,SUA BATATA JA ESQUENTOU SEU BEBADO E LADRAO DO POVOCADEIA NELES DRSERGIO MORO 
966,yes,ADVOGADO DE BANDIDO E BANDIDO IGUAL E TEM QUE SER EXTERMINADO
967,yes,ACHO QUE O AECIO NAO TELEFONOU PARA O JUIZECO HOJE TA DANDO PITI DE SAUDADES KKKKK
968,yes,A mamis ja foi ne Mas eu chamo sua mulher  de mamis Sabe nada inocente
969,yes,AdiANALdo  A prega no final continua firme e forte 
970,yes,Igual a da sua mamis Uma prega indestrutivel  kkkkkkkkkkk
971,yes,Ruy vc acreditava no Japa da Federal tb ne Jumento
972,yes,Entrou no seu fedidinho Junior  Esse ui e proprio da sua gayzisse
973,yes,O dia do seu macho vai chegar Aguarde compre lenco pro choro Esterco humano
974,yes,Alexandre esta maluco so pode comeu titica quando crianca
975,yes,Olha se fosse assim ja tinham prendido e esquartejado o luladrao e kd 
976,yes,Junior no nome e marmota nas atitudes Ooooooo sujeitando tapado
977,no,Acordem Trouxinhas A casa esta caindo
978,no,A bixaria coxa ta no desespero 
979,no,a bixaria da mortadela ta no desespero
980,yes,La vem mais um afeminado Peta invadir comentario alheio Uiiiiiiii nojentaaaa
981,yes,quando sua me devolver o troco de R  pelo servico oral que ela me fez
982,yes,Adinaldo kkkkkkkkkkkk De novo defe cando mortadela
983,yes,Nao Junior Soares Defequei uns juniorizinhos soares aqui
984,yes,Todos com o nordeste sempre os bandidos estao todos no sudeste
985,no,ceis tao tudo e dano buesta cai esse ano
986,yes,Esse BOFE do Joao Paulo alem de ser LINDO deve ter um PAUlo MARAVILHOSO Noizinhas do MENGAO amamos SRNSomos Rabudas Negao  dcm DIAMETRO CRFCheirinho R Fedida
987,yes,NOIZINHAS do MENGAO temos um URUBU que se chama NKU para os jogos neste ano contra os BOFES dos outros times devemos levar NKU ou deixar NKU Por favor o que devemos fazer SRNSomos Rabudas Negao  dcm DIAMETRO CRFCheirinho R Fedida
988,no,Mais umo povinho idota
989,yes,Menor fica minha piroka quanto mais da metade ja ta dentro docusso da sua mae
990,yes,Enquanto issoO Palmerda bi rebaixado continua sem mundial Kkkkkkkkkkkkkkkkkkkkkkkkkkkkk
991,no,Cabra frouxo
992,no,Arregao
993,no,Faltou uma opcao Ele virou homem
994,yes,Vai procurar uma pra mamar Freddie Mercury E o melhor que saber fazer rubroneca
995,yes,Velho babao para de falar asneiras na nossa pagina
996,yes,Sonha boneca
997,yes,Aa que isso  as tricoletes estao descontroladas
998,yes,RUBRONECAS
999,yes,Vai retocar a maquiagem tricolete O frufru nao come ninguem ele e comido 
1000,yes,IDOLO DO FUDINENSE E SERIE B TEVE QUE ENTRAR NA JUSTICAO PRA NAO CAIR
1001,yes,As rosquinhas das tricoletes estao ardendo por causa do Conca Pode   
1002,yes,Dorzinha de cotovelo e coisa de florzinha einMimimimi 
1003,yes,As Florzinhas ficaram chateadas KKKKKKKKKKKKKKKKKKKKKKKK
1004,yes,Mulambos subornadores paguem a Serie B
1005,yes,Meigos eles sao mas cheiroso nao Fedem a Urubu
1006,yes,Eu quero ver o Abel brucututreinando esse time de bonequinhasnao vai da certo 
1007,no,Paulo cid mata baratas quando ele assinar o contrato depois de um mes ja recebe o salario integral ou vc acha que ele vem da china para o fra e vai ficar  meses sem receber Nao acredite em tudo que sua diretoria fala inocente
1008,no,minha diretoria e transparente e nao mente igual a  de voces nao tudo q o flamengo fala e concreto e fato tem credibilidade
1009,no,so queria dizer que   po de arroz e maquiagem    sem mais  ha e antes que eu me esqueca paguem as series b  
1010,no,Se a empresa concorrente da sua te oferecesse um super contrato de trabalho voce trocaria de empresa Quanta gente hipocrita nessa torcida do fluminense aff
1011,no,So ve um lado da historia voce Se eu to com a vida ganha ganhando quase  milhoes por mes durante  anos por culpa do Fluminense pq ele nao era nada antes disso Eu sinceramente jogava ate  de graca Essa era a obrigacao dele A melhor forma de retribui essa vida boa que ele ganhou gracas ao Fluminense O que e  mil perto de tudo que ja ganhou  Isso se chama ganancia mercenario nao e idolo
1012,yes,KKKKKKKK COM UNS CARAS DESSES QUEM QUER JOGAR NO FUDINENSE 
1013,no,Bbcas serie c vcs nao saben Separar quantos trocaram de lado epoca de doval dos trocas Fla x flu vasco x bota Jogadores marcaram epoca e historias Vcs sao eternos serie c 
1014,yes,A calcinha da tua mae ja tirei faz tempo e com facilidade pergunta pra ela
1015,no,desde que ele contribua e a gente levante a taca ta de boa o flamengo so vai pagar quando ele comecar a jogar mesmo
1016,no,Maycon ate admito que o negocio em si foi bom para o Fla mas atualmente nao acredito em nenhuma das duas coisas nem que ele va jogar bem e nem que o Fla levante alguma taca esse ano kkkkk
1017,no,Rafael dois finalistas da Libertadores do ano passado Um deles titular da selecao Equatoriana o outro futuro camisa  da selecao Ambos ja sondados por clubes da Europa Quem vai dar certo mesmo e o Conquinha com  anos e todo bichado kkkkkkkk
1018,yes,estao melando as calcinhas as tricoflorzinhas
1019,no,Comparacao sem nexo Tyson passou quanto tempo no auge pra chegar a fazer isso e tu sabes o motivo  Tyson e um mito que infelizmente se perdeu no fim de carreira
1020,no,Nao entendi essa comparacao o Tyson nunca foi um exemplo pra nada muito menos no ambito psicologico
1021,no,sempre disseram que a ronda nunca pegou uma adversaria de verdade qdo pegou alguem que bate forte mesmo afinou ela vivia correndo da ciborg pq sabia que ia perder as vezes nem e medo de apanhar e sim de parar de lucrar 
1022,no,Mas ela nao parou de lucrar perdendo inclusive nessa ultima do valor total  foi o valor pago so pra ela
1023,no,Imperador isso e balela Entao as outras nao sao adversarios de verdade E o mesmo que eu dissesse que Anderson Silva nunca pegou oponente de verdae quando pegou um bom wrestling perdeu duas 
1024,no,E so colocam ele pra pegar as novas safras ai e q a surra e pior ainda essa luta nao passa nem do o round podia colocar ele contra os semiaposentados pra ver se tinha alguma chance
1025,no,Na categoria so TJ tem chance consideravel Cruz tambem mas menos no entanto ainda apostaria em Cody Ja contra Aldo ele nao seria o favorito Aldo usaria  bem os jabs e os low kicks e faria uma luta estrategica
1026,no,A historia desse cara com o moleque que subiu no octagon pra receber o cinturao e muito louca O cara pode ate ser sangue no olho mas o que ele fez pra ajudar o moleque nao e qualquer um que faz
1027,no,Nao e afoito nao Contra o Cruz foi muito paciente atraindoo para trocacao franca So deu blitz contra os adversarios anteriores contra quem tinha grande confianca nao sem motivo de que botaria para dormir
1028,no,Vich todo evento ta caindo luta do card principal  Ta na hora do Dana comecar a ter substitutos pra esse tipo d situacao q faz tempo q ja deixou de ser inusitada  
1029,no,Cruz so tem agilidade mesmo poder de nocaute zero o Cody veio muito mais preparado por isso levou essa
1030,no,Meus caros amigos enigmaticosNao deveriam comparalo ao Tyson Tyson e um grande mito do boxe  mas que deixou a desejar no lado pessoal  Entao se nao e bom no lado pessoal ou no profissional o cara nao e completo Chequei nesse raciocinio assistindo o Faustao       
1031,yes,Ele chamava pra atras da escola e sentava nos garotos kkkk
1032,no,Jhalim Rabei ate fiquei assustado comecei a ler seu comentario pensei que ele Connorlevava os meninos para tras da escola e dava a bunda para eles KKKKKKK
1033,no,Irmao Honorato sempre falando verdades e agindo com a razao ao inves da emocao diferente dos tupims Te amo seu lindo