id,class,text
510,no,o neymar faria alguma falta na selecao ou a sua ausencia seria melhor  
511,no,Parece aquelas perguntas ridiculas da globo no meio do jogo
512,no,Felipe massa ja vai se aposentar O que sera dessa selecao 
513,no,Bauza retranqueiro vai botar pra cacar o neymar podem tirar print
514,no,Marinho e um jogador que desequilibra qualquer jogo
515,no,Tomara que a Argentina goleie estes frescos
516,no,O Sao Paulo ja foi rebaixado 
517,no,VAMOS MASSA ATLETICANA LOTAR O MINEIRAO PARA APOIAR A ARGENTINA DE LUCAS PRATTO
518,no,VAMOS MASSA ATLETICANA LOTAR O MINEIRAO E APOIA O PRATTO
519,no,O Pratto ai lado de Messi  vai deitar e rolar em cima da nossa selecao falida
520,no,Mas ele so pipoca quando a coisa aperta sempre foi assim
521,no,Pipoca nada e um excelente zagueiro o  a  nao foi culpa dele
522,no,vamos voltar  anos atras e ver o que ele fez no  x 
523,no,corinthians o melhor aluno do enem enemlibertadores enempaulista enembrasileirao enemcopa do brasil
524,no,Ele virou goleiro
525,no,quem nasceu para ser  a  jamais sera Junior Baiano 
526,no,Ta jogando bem mais na selecao nao tem mais chance   Thiago Silva marquinhos Miranda sao melhores  
527,no,Jogar no PSG e decrescimo na carreira
528,no,na  boa  davi luiz  deu muito certo coma  camisa  do chelsea no  psg  nao era  pra  ele
529,no,Em compensacao de vez em quando leva 
530,no,Globo iniciando o lobby para o seu retorno para a Selecao
531,no,David Luiz agora e goleiro pra ter recorde pessoal de menos vazado
532,no,E aqui toma  em um jogo so o cara e muito ruim
533,no,ele possui outro recorde tomar  gols em um jogo
534,no,Cahill ainda tem pesadelos com Emerson Sheik e Paolo Guerrero
535,no,Ele so vai igualar o record pessoal quando ficar SETE jogos sem levar gols
536,no,Joga muito
537,no,Esses fans e torcedores do CR e Real Madrid sao uma piada Raca nojenta 
538,no,Melhor do mundo
539,no,Apelando nao compara com qualquer um ele joga Facil
540,no,Melhor do mundo e o Messi aceitem este fato Ronaldetes
541,no,essa modinha de rivalidade os  sao excelentes jogadores pronto
542,no,Daniel Lima Nao e rivalidade e a verdadeMessi esta acima de todos no futebol atual
543,no,e kkkkkkkkkkkkkkkkkkkkkkkkkk Pepe tbm ganhou e fez mais que CR man 
544,no,na moral e ser muito louco dizer que CR e melhor que Messi por favor velho
545,no,Mano na boa Messi ja foi eleito o melhor fora de outro time Se for seguindo esse teu criterio Pele George Best Maldini Iniesta  Garrincha e muitos outros sao uns BOSTAS pois esses citados nunca foram os mesmo em outros times e algunsMaldini e Iniesta nunca chegaram a jogar por outros clubes  Pele jogou por  anos no Santos e ninguem disse nada 
546,no,Mano na boaAngelim  volte pro video game rapaz O cara fala Messi ja foi eleito o melhor fora de outro time  E por acaso o Pele foi considerado melhor em outro  Ele no Cosmos ja estava no final de carreira Nao existe isso de tem que provar em outro clube Se for seguindo essa tua logica Iniesta e uma bosta segundo voce
547,no,Isaque nao se faca de tonto Chore menos sua Lionete
548,no,Mano na boa como eu sabia A Ronaldete nao tem argumentos
549,no,Mano na boa na boa mesmoManona boana boa manoManooooooooo 
550,no,CR ja ganhou a Copa America Nao Julio Baptista SIM  kkkkk  to aqui so pra zuar mesmo kkkk
551,no,So uma pergunta O que seria do Real Madri e Barcelona sem os estrangeiros 
552,no,Seriam grandes clubes afinal sempre tiveram jogadores nacionais que fizeram historia
553,no,So te corrigindo O que seria a Europa sem estrangeiros
554,no,Os  do Rio os  de Sao Paulo  do Rio Grande do Sul e  de Minas Gerais   grandes 
555,no,pele nunca vai ser melhor q esse cara
556,no,kkkkkkkkkkkk tulio nao ele conta ate de golzinho no asfalto
557,no,Falta muito pra chegar ao maior artilheiro de todos a grande genio da area Romario
558,no,No videogame igual aos fas alienados dele kkkkkkkkkkkkkk
559,no,o cara foi foda
560,no,enquanto isso o Palmeiras continua sem mundial
561,no,Em discurso Cristiano declarou Para de me secar NETO
562,no,So o oculos dele deve da pra comprar um apartamento 
563,no,Enquanto isso seu time contrata marcelo cirino por  anos e damiao por  ano e meio
564,no, gols em  jogos oficiais media de  Melhor do mundo
565,no,Deve ganhar o premio FIFA foi o melhor da temporada
566,no,Ficam um monte de mocinhas brigando por Messi e CR Virem homens
567,no,vai ter que pedir dicas pro Ze para pder jogar ate os 
568,no,ROMARIOgtRONALDOgtZIDANEgtMESSIgtRONALDINHOgtCR
569,no,Vao ter que renovar o contrato do Sergio Ramos ate  tbm
570,no,Nem Messi nem Cristiano vao dormir hoje preocupados com o que vcs acham deles Tontos
571,no,Ja nao ta jogando mais nada hj em diaimagina em 
572,no,Se nao ta jogando nada hoje imagina em   Vai ta no nivel do Alecgol  
573,no,QUE LINDINHO ESSE MOCO COM ESSE OCULOS
574,no,Sera que teremos tambem mais cinco anos de propaganda com o Clear men kkkkk
575,no,sai armario na mesma velocidade em que baixa a qualidade de seu futebol
576,no,Contrato de  anos Esses clubes sao loucos  anos no maximo
577,no,Real Madrid ta doido mesmo o cara nem empurrar a bola de baixo da trave consegue mais
578,no, temporadas pelo RALA e  titulos kkkkkkkkkk Messi em  anos de Barca tem  titulos
579,no, titulos sendo que uns  Trofeus Joan Gamper que e um amistoso Bela galeria
580,no,Mano na boa Ivo Holanda sao  titulos sem o Joan Gamper
581,no,Mano na boa Valdeny as coisas nao funcionam que nem no seu mundinho nao
582,no,Nao teve nenhum penaltizinho pro inutil Penaldo bater  Ahhh poxa juizao
583,no,Mano na boa quase que ele faz um hattrick Solange So faltou  penaltis
584,no,Atras so do Robinho e do Fred campeoes da Copa do Brasil 
585,no,Bom jogador Daria um bom reserva para o Fernandinho no Fla
586,no,Entao vamos somar as assistencias para ver quem ganhaOs dois sao otimos mas Messi e melhor
587,no,daqui a pouco vem um falar de titulo na selecao
588,no,no momento nao esta nem entre os  melhores  mas joga facil
589,no,Piada super engracada Ja pensou em fazer um teste pro Zorra Total 
590,no,Concordo  por cento
591,no,Bom jogador mais nunca jogara oq o Marcelinho Carioca jogou no todo poderoso timao chorem antis
592,yes,Lugar de mulher e na pia fogao e cama
593,no,E o CR ganhou tudo o que o Messi nao ganhou Choremmmmmmmmmmmmmmmmmmmmmmmmmmmm
594,no,Voce nem sabe o que fala mano voce nem sabe chutar uma bola ENTENDE NADA DE FUTEBOL CRFOREVER
595,no,Geraldo Gallo vamos protestar Amigo Vamos invadir aquele CT e quebrar tudo
596,no,Marias tremem pro Galo e borram pros argentinos FATO
597,no,PARE COM ESSE VEXAME GENTE DEIXA ESTE CARA DE LADO
598,no,Saudade do Otamendi Ele e Gabriel seriam uma dupla de zaga sensacional
599,no,dor de cotovelo das marias azuis borradeirasadoram a pagina do galo
600,no,Em pontos corridos nao tem apagao de refletor pra esfriar o adversario rajkazblanks 
601,no,Em pontos corridos nao tem jogador adversario escorregando com o gol escancarado rajkazblanks 
602,no,Em pontos corridos gritinhos de eu acredito nao colam rajkazblanks 
603,no,Em pontos corridos nao tem disputa de penalty rajkazblanks 
604,no,Em pontos corridos nao tem Riascos pra errar penalty aos  do segundo tempo rajkazblanks 
605,no,com Anelkocando ate hj Maria Ele nao e argentino nao viu Todos sabem q as Marias se borram pros argentinos
606,no,E uma pena que Riascos nao e Argentinota marcado na historia por dois momentos marcanteskkkkk
607,no,MARIAS NOS CIO  MINHAS PRESAS PREDILETAS VOU ME ESBANJAR EM DEVORALAS
608,no,Forca na peruca Galo RACA ROBINHO RACA PRATTO RACA CAZARES Vamos jogar com amor a camisa 
609,no,Concordo em partes Tem que ter sombra pro Vizeu se nao se acomoda igual ao Jorge
610,no,NAO ACHO NADA DEMAIS NESSE CUEVA SO FAZ GOL DE PENALTY
611,no,Junta todos os pontas do Fla que nao da um Cueva
612,no,o Flamengo sem motivacao nenhuma mete  x no santos
613,no,QUEREMOS UM TIME PRA GANHAR O TITULO E NAO PRA FICAR NO MEIO DA  TABELA NOVAMENTE 
614,no,Ue e o cheirinho que voces estavam sentindo era de que
615,no,Vizeu e convocado frenquentemente para a selecao sub quem ia ser o centroavante CIRINO
616,no,Devia e ficar o Damiao e sair o inutil do guerrero chorao
617,no,esse ze e  muito burro cara empresario corre solto e muita grana envolvida
618,no,O   PARA  TB   SE ACOMODOU UM POUCO  PODERIA REVESAR ELE E O RODNEY 
619,no,perfeito os garotos da base sao melhores que esses jogadores citados
620,no,e rogerio todos tem mais essa anta nao coloca pra jogar
621,no,o tecnico e bom o time que e ruim 
622,no,Complicado e colocar o Cirino e Gabriel atacante que nao sabe chutar nao faz gol
623,no,CariacicaES ainda seria melhor Bota o jogo contra o santos e o coxa la
624,no,correto  Adriano Adryan e melhor q Cirino Gabriel Fernandinho etc
625,no,O SANTOS TODO LANCA DOIS  GAROTOS PORQUE O FLAMENGO NAO FAZ O MESMO
626,no,Porque e menguinho so vcs que pensam e falam que e grande
627,no,ze vai cuidar do titulo   jogos  mexendo mal 
628,no,O cara que coloca  chiquinho  para  cirino e gabriel para jogar nao pode ser normal
629,no,pois e os  nao foram peidods por ele para  montar o elenco entao nao vamos da porrda no cara
630,no,ELENCO GRANDE E DE POUQUISSIMA QUALIDADE 
631,no,Abel Braga ano que vem Pra disputar a libertadores e manda Gabriel e cia embora 
632,no,Voce nao pode estar falando serio
633,no,THIAGO SANTOS EH MELHOR Q GABRIEL FERNANDINHO E CIRINO JUNTOS PQ O GARORO N JOGA
634,no,Coloca os moleques no carioca pra pegar experiencia
635,no,Se for o Ze Ricardo o Tecnico da Libertadores e entregar mais uma vez ao titulo ao palmeiras
636,no,Demorou so digo isso 
637,no,ze ricardo e doido o time empata perde ele continua com esse gabriel  so pode ser um caso de amor
638,no,Base  Com Ze nao tem vez So jogo la medalhao e jogador de empresario Politica dinheiro no bolso 
639,no,NAO E POSSIVEL QUE ESSE CARA VA CONTINUAR NO COMANDO  DO TIME EM   
640,no,SE ZE CONTINUAR NAO VAMOS GANHAR NADAEM HORAS DECISIVAS SEMPRE ERRA
641,no,Ze ricardo nao sabe avaliar nem os jogadores profissionais q estao com ele que dira a base
642,no,Verdade nao sabe mesmo  Escala mal e substitui pior ainda E o culpado pela perda do titulo
643,no,O culpado pela perda do titulo e o mesmo pela briga pelo titulo kk via entender  
644,no,Prefere usar o Damiao do que o Vizeu Sem comentarios
645,no,Um volante da base PELO AMOR DE DEUS para o lugar de Marcio AraujoPELA AMOR
646,no,UM DOS MELHORES  SE NW O MELHOR E RONALDO   DE VOLANTE OU LATERAL  JOGA  MUITO
647,no,ze ricardo     ta de brincadeira   culpa desse mane  todo jogo um time diferente  fanfarrao
648,no,gigante que nao ganha um nacional a  anosta de sacanagem ne
649,no,De tanto falarem em cheirinho perderam o olfato Rsrs
650,no, O Flamengo vai assumir a ponta a Demora e voltar a jogar no Maracana
651,no,Cai na Real vascainos segundo da segunda  Kkkkkkkkk
652,no,Mas o JUIZ e os DOIS BANDEIRINHAS que GARANTIRAM mais um ROUBO estao acertados pra 
653,no,ADRIANO   IMPERADOR    E   WAGNER  LOVE  E  RONALDINHO   E  FABIO  LUCIANO
654,no,muitos jogadores sem condicionamento fisico pra disputar um brasileirao deu nisso
655,no,Nao contratava mais medalhao o flamengo so gasta e gasta tendo os garotos da base
656,no, O  que gasto no cuellar erradamente dava pra ter comprado o cueva
657,no,Santos Kkkkkkkkkkkkkkkkkkkkkkkkkkkkkkkkk torcidinha cabe em uma Kombi kk
658,no,o cara se gaba de ser segundo eh pra quem nao e mais nada ser segundo e alguma coisa ja
659,no,So ganha se ROUBAR senao e CHEIRAO DE F E Z E S mesmo
660,no,Padaria do Flamengo esta vendendo muito o sonho ja acabou so resta pao 
661,no,STJDacorda essa pagina e rubro negraseu viceADO
662,no,Digam o que quiser mas da Copinha e da OPG so a arbitragem sao promessas para  KKKK SV
663,no,A GAROTADA RUBRO NEGRA MANDOU LEMBRANCA DE DENTRO DA SUA CASA KKKKKKKKKKK
664,no,O Vitor Nastari  voce esta e com a cabeca cheia kkkkkkkkk  imagine   kkkkkkkkkkkkkkkkkkkkkkkkkkkkk
665,yes,era o cheiro da bucelta da sua mae
666,no,Vamos iniciar  levando porrada Essa molecada nao tem nem corpo Vao pipocar
667,no,Concordo pois ele e bom para montar time
668,no,Verdade mas a maioria so olha pra tabela Entendem nada de futebol
669,yes,Tenho nojo do flamengo timinho de torcida terceirizada de nordestinos fedidos que pensa que e carioca da gema quando nao passa de um time que tem mais identificacao com o nordeste do que com o rio Quando se fala em flamengo se imagina um monte de paraibas fedidos e sem agua falando FRAMENGO e com camisa do camelo Respeito o Vasco e o Botafogo esses sim quando se fala em rio de janeiro se lembra deles Saudacoes corinthianas
670,no,desnecessario ofender o flamengo tudo bem agora envolver outras partes ai ja nao apoio 
671,no,Dinheiro a gente pega com quem tem Nao com quem ta quebrado
672,no,Lateral direito dois zagueiros e um atacante ja resolve grande parte dos problemas do Cruzeiro
673,no,So espero que ele recupere o bom futebol
674,no,a soberba ela nao acaba kkkkkkkkkkkkk
675,no,Relaxa Veremos daqui  rodadas Soberba
676,yes,isso e uma bishona daqui a pouco ele fala que se o leicester ganhar a champions ele da ucu
677,yes,Esse negro e o seu pai Sua mae deu pra ele quando jovem
678,yes,Voce ta e na zona sua galinha
679,no,Com o Botafogo tudo e dificil Eu acredito na classificacao Avante Glorioso Botafogo
680,no,Esse ano pra vcs foram muitas frustracoes eliminados de tudo que participaram e mais a de ontem 
681,yes,ah vai se fu de voce
682,no,o fanatismo nao e uma doenca fisica e nem espiritual mas sim uma doenca da ignoranca e odio   
683,no,Voces precisam pesquisar melhor a historia do campeonato de  
684,no,Nao houve rebaixamento pois existiam duas ligas
685,no,Ele e ficha suja e esta inelegivel nao sabia
686,no,kkkkkkkkkkkkkkkkkkkkkkk faz me rir
687,no,Palmeiras nao tem mundial
688,no,Inveja matahhhhhhh
689,no,time de um gol so muiuta sorte
690,no,O importante e ganhar meu filho acorda pra vida
691,yes,MULAMBOS  SETEM O CHEIRINHO DE HEPICANUNCUKKKKKKKKKK
692,no,o brasil todo  menos a torcida do inter hoje e Corinthians obrigacao e ganhar  
693,no,Nao temos timeTemos um bando de jogadores meia bocatodos sem nenhuma qualificacaoBarcaJA
694,no,ATENCAO NOVA DIRETORIA QUEREMOS UM TIME COMPETITIVO EM   
695,no,Traz ele de volta e deixa ele escolher o tecnico 
696,no,Mas ele vai preso Aguarde
697,no,Dois mundias com uma libertadores 
698,no,Futebol argentino e uma piada  So pancadaria e confusao           
699,no,A bandidagem continua se escondendo
700,no,Ele esta feliz em voltar a Bahia menos o povo baiano
701,no,Sua hora vai chegar
702,no,E DALHE DALHE PORCO E DALHE DALHE PORCO CHUP MOLAMBOS FICARAM SO NO CHEIRO
703,no,quando Deus diz nao nao adianta lutar contra
704,no,Esse nao roubouao menos nesta gestao
705,yes,Ragnar e nome de travesti da Escandinavia
706,no,Entrei so pra ler os comentarios dos peritos
707,no,Emocionada pela morte ou pela posse
708,no,Fizeram pericia nas pecas do carro
709,no, SERA POLICIA FEZ PERICIA NO CARRO  ESTRANHO NE 
710,no,Sera que foi sabotagem
711,no,Melhor investigar a oposicao
712,yes,MENOS UM MAS TEM QUE QUEIMAR LOGO O CORPO DELE ANTES DE CHEGAR NA PORTA DO NEM SEI E POLITICO MESMO  DO INFERNO
713,no,No Nordeste acontece de tudo 
714,no,Idiota
715,yes,o investigador investiga isso vcefdpta
716,yes,Esse ai senta na boneca
717,no,Aposto que ainda vai ser o presidente da camara
718,no,E a roubalheira continua Esses sao profissionais
719,no,Banco cheio de problemas governador 
720,no,So pela metade Voce esta sendo bem otimista
721,yes,Paulo vai to mar no c uu
722,no,Alex exponha seus argumentos abc
723,no,e tome dinheiro pra industria da seca
724,no, Milhoes para Sergipe  e  Milhoes pra Alagoas   Governador de Sergipe e um Bndaum Mesmo 
725,no,Seca no Amapa so pode ser brincadeira
726,no,Esse e meu presidente
727,no,Esse dinheiro ira fazer brotar agua do solo 
728,no,Mais dinheiro desviado em   
729,no,Esses recursos vao sair de onde 
730,no,Ele vai ser o pior presidente da historia
731,no,ele nao e presidente  e golpista
732,no,AECIO E O UNICO CAPAZ DE TRANSFORMAR ESTE PAIS
733,no,Finalmente o Senador entendeu Parabens
734,no,Fiquei chocado com essa noticia
735,no,Voce e meia duzia pensam assim
736,no,Passei por aqui so pra deixar meu FORA TEMER
737,no,lazarentuuuuu
738,no,Sera muito bom para suas empresas para o povo nao
739,yes,Reforma estrutural no seu rbbono meu nao
740,no,Pode prender inocente  
741,no,Que tornozeleira eletronica
742,yes,hmmmmmmmmmmmisso e uma bichna
743,yes, Entao e da lojinha da anta
744,yes,e da lojinha da tua mae aquela prostituta
745,no,Ainda temos que aguentar uma ironia dessa
746,no,Os netos que devem ter vergonha dele
747,no,Cara    de    Pau         
748,no,Boca mole e bolso e contas bancarias abarrotadas de dolares Sahfado
749,yes,Boca de buxeta
750,yes,E O PIAUI QUERENDO ASSUSTAR O MUNDO COM ESTA FIGURA OU SO NASCE GENTE FEIA LA
751,yes,Vermelho nojento deveria levar um tiro na cara bandido 
752,yes,Vagabundo
753,no,A corrupcao e o cupim que corroi a democracia e as instituicoes  
754,no,A corrupcao esta estampada na cara desse individuo
755,yes,desgracado bandido mais bandido ainda e quem vota numa desgraca dessa  eta povo burro 
756,yes,Raposao politico de profissao  ta no fim da carreira e o Piaui o adora  Eh boca mole eheheh
757,yes,Vai pagar muito boq na cadeia para outros presos com essa boca de buc inchada
758,no,E tanto deboche tanto escarnio perderam o senso de ridiculo de humilhacao
759,yes,Debil mental 
760,yes,MELHOR SERIA C U DEPOIS DE DIARREIA
761,yes,Eu ja havia arranjado um apelido para ele aqui em casa ocuquefala
762,no,Quando esse cara comeca a falar eu mudo de canal
763,no,que absurdo estou indignado com essa chacota 
764,no,Voce sabe quais os atos enriquecem o curriculo de um bandido Entao esta explicado
765,no,kkkkkk 
766,no,Estourou o placar quanto e isso
767,yes,Esses petebas sao piores que asnos puxadores de carroca
768,yes,E a mesma denuncia burrao
769,yes,O pior e que e a quinta ele nem pode contar nos dedos da mao que lhe falta kkkkkkkkkkkk
770,yes,Queremos ele morto
771,yes,ONU  KKKKKKKK ONU e bosta e a mesma coisa seu anta
772,yes,Ele vai  sentir o peru entrar
773,yes,o moro vai sentir o peru do aecio entrarkkkk
774,yes,Carlinha Antinha a servico dos petebas Ridicula
775,no,E muita denuncia e pouca acao
776,no,Muita denuncia e pouca acao 
777,no,Muitas denuncias muitas provas e pouca cadeia 
778,yes,Joao retardado presta atencao na gangue que esta tomando o Brasil de assalto 
779,no,Entao vamos perdoar o Ladrao so porque a outra turma tambem e nao seria melhor prender todos
780,no,Todos sabemos e que por causa da pesquisa de ontem no qual ele poderia ser presidente em 
781,no,Todos ou voce duvidava dessa medida tao rapida do MPF
782,no,calma tudo e questao de tempo lembra do Cunha
783,no,So com conviccao nao se prende ninguem 
784,no,E verdade mas apesar de acha que essas pesquisas sao furadas
785,no,os politicos sao o reflexo do povo
786,no,Vai fazer a denuncia e pede para um juiz pegar o caso blz
787,no,Curitiba esta mais esperta que voces pensam
788,yes,Concordo com o Carlos Isso aqui e lavagem cerebral pra asnos
789,no,E TEM QUE PRENDER LOGO ANTES QUE ELE FUJA PRA CUBA
790,no,Eu voto em quem ele indicar
791,no,Kkkkk
792,yes,Olha ai um esquerdopata cmedor de alfafa me negativou  
793,no,Pesquisa comprada
794,no,E SERA MUITO BEM RECEBIDO PELO JUIZ SERGIO MORO
795,no,Prendam logo o chefe mor da corrupcao
796,no,Nunca Nao existe materialidade So conviccao 
797,no,Na verdade  mesmo ja passou da hora 
798,no,PARA ALGUNS ACEFALOSESTE CIDADAO SE TORNOU UM MITO  MAS A CADA DIA PERCEBEMOS QUE NAO PASSA DE UM RATO LADRAO  ME DIGAM O CONTRARIO 
799,no,A casa caiu
800,no,Cade as provas
801,no,JA VIROU NOVELA CHEGA CANSAMOS
802,no,Falta pulso
803,no,Que materia espetacular em Grs
804,no,Denunciado hoje de novo ok mas preso quando 
805,no,NUNCA  JAMAIS SERA 
806,no,O fato e que Nao ha um politico honesto no Brasil
807,no,Isso ai e a materia ou so o titulo Kd o resto
808,no,E O QUE ISSO QUER DIZER MESMO 
809,no,So denuncia mais prender que e bom nada
810,no,Nao entendi o que ta faltando pra ele ser preso
811,no,Quando ele sera preso 
812,no,Denuncia  denuncia  denuncia  cadeia quando  
813,no,Indiciam e denunciam mas nao prendem
814,no,o triplex caiu
815,no,Finalmente ele vai ser preso
816,no,E os tucanos  reis das delacoes 
817,no,Quem que era mesmo o Homem mais honesto do Brasil
818,no,Desordem e Regresso 
819,no,Srs JUIZES PREDEM LOGO ESTE BANDIDO 
820,no,Essa noticia e antiga
821,no,Vai ser preso antes do Natal
822,no,muito processo pouca gente em cana
823,yes,QueseFODAesseFDP e quem gosta e defende ele tbm
824,no,Uma enorme e bem recheada pizza
825,no,Denuncias nao enche barriga precisa fazer valer
826,no, indiciacoes em  semana ja pode pedir musica
827,no,estao tentando desviar o foco 
828,no,O Serra com  milhoes nada tambem
829,no,Nao vai dar em nada
830,yes,G CANALHAS E OS COMENTARIOSENFIA LA
831,no,Ententam uma coisa nao ha denuncia sem provas
832,yes,e um monte de bosta mesmo no minimo e do norte ou nordeste que trabalhar que e bom nao trabalha vive do bolsa familia por isso vai votar no luladrao
833,no,Cade as algemas
834,yes,tu isso tu aquilo o gauchada boiola kkkk
835,yes,Guy Gay boiola e tu e teu pai
836,yes,Sabe o que e foro privilegiado seu bosta  Burro
837,yes,Vai dar de  pro lulao vai Mas leva viagra
838,no,Deixem o cara em paz
839,no,kkkkkk
840,no,Credo a Globo esta instigando a violencia
841,yes,O filhodaPhuta do Brasil 
842,no,Quando provar irao para a cadeia
843,no,Isso porque voce coloca rotulos nas pessoas
844,yes,O encantador de burros pegou mais dois
845,no,kkk voces sao uns comedias
846,no,MPF a trabalho dos interesses tucanos e pmdbistas
847,no,Nao pode ser serio o que acabei de ler
848,no,tem que investigar quem te deu aula de portugues
849,no,Porque ele esteve no poder por  anos talvez
850,no,Brincadeira e vc acreditar realmente nisto
851,no,Qual deles cade as denuncias
852,yes,BURRO ASNO TOPEIRA
853,yes,Mulher grossa estupida e ignorante 
854,yes,Alem de burro e analfabeto
855,yes,Hahahahahaha jumento
856,yes,Vai la lamber as bolas dele
857,yes,Que tipo de idiota abestado e voce 
858,yes,Vai lavar panela sua vaca
859,no,Idiotao E quem e o sabidao
860,yes,Romulo come bosta
861,yes,Lizzie come bosta
862,no,Acho que ta faltando provas
863,yes,Tinha que ser baianoputz que povinho
864,yes,KKKKK MAIOR LADRAO QUE MERECE A MORTE 
865,yes,Cala essa boca jumento
866,no,E serio isso 
867,yes,Pobre BURRO neque apoia a direita
868,no,Peco mais respeito por favor Falei
869,no,Entao peco um pouco mais de respeito Falei
870,yes,  GABRIEL  VOCE  DEVE  SER  UM  GRANDE  COVARDE    SE  VOCE  PEIDAR  VOCE  SE  CAGA  TODO          
871,yes,Esse asno ainda tem meu nome ta de sacanagem
872,yes,Sao paulinos gostam de mamar no cajado
873,no,Mas ele nao e  do futebol paraguaio
874,no,Tomara que esteja certo colega
875,no,No fim vamos ficar com os que ja estao ai
876,yes,Vc  deve ser retardado  
877,no,o cara e bom joga muito
878,yes,Enfia no rab o da sua mae
879,no,Eu acho que voce esta na pagina errada
880,yes,Andre noiado ver se diminue o fumo Ta dificil
881,yes,coloco vc otario ou su amae
882,no,Que moral idiota quase nem voltaram Kkkkkkkk
883,yes,SRN Sou a R A B U D A do Negao
884,yes,Eu passei na tua mulher e deixei minha g o z a d a
885,yes,Jkkkkkkkkkbosta de clubenao tem dinheiro pra contratar pra comprar camisa mas tem Estadiokkkkkkkkkvice eternopiada do Brasil Segunda eu volto
886,yes,P I R A N H A
887,no,Fundo do poco mesmo
888,no,Virou bagunca 
889,no,Isso e comum com times pequenos
890,no,isso e falta de dinheiro em um clube falido
891,yes,Mais um jogo e o flaF E Z E S sem estadione g l o b o
892,no,Da ate pena esse time so passa vergonha 
893,no,Sempre uma varzea Time pequeno e assim mesmo
894,yes,Cala boca o idiota 
895,no,esse ai e matador
896,no,Gostei das mudancas Novas estrategias
897,yes,outro asno que nao sabe nada esse artur
898,no,Esse MITO sabe tudo de futebol 
899,no,ainda precisa de centroavante e lateral esquerdo
900,no,Volante centroavante e lateral esquerdo
901,no,Foi divulgado sim procura ai que tem
902,yes,Esse time em que todos gostam de ceder a cauda
903,yes,e vc e analfabeta
904,no,Sera que agora ganha copa do Brasil 
905,no,Que diferenca faz 
906,yes,mas no sao paulo o apressado come C u
907,no,Nao da nem pra comparar fato
908,no,Verdade e triste mais e verdade 
909,no,no fim tudo dara certo  Rumo a gloria
910,no,JOGADOR DE TIME PEQUENO
911,yes,Walter devia lutar SUMO PODERIA SE DAR BEM
912,yes,O gordao ainda fica rindo consegue nem ficar de pe
913,yes,burro
914,no,o dirigente falou alguma mentira
915,no,Ja ta chato essa historia do Walter td ano e isso
916,no,Nao importa sao os mesmos jogadores
917,yes,Esse sorriso sonata nunca deve ter visto e nem jogado futebol Marcelo e Daniel Alves jogam a anos em times de ponta da europa ja ganharam ds os titulo ja estiveram varias vezes na selecao do mundo e vem esse bosta falar q eles sao ruins
918,no,quem e o reserva desse capaz de vir o reserva
919,no,onde tu viu isso
920,no,se vier e um otimo reforco
921,no,Se vier  sera  um bom reforco
922,no,excelente jogador  sera titular ao lado do Jo
923,no,seja bem vindo que faca um bom trabalho
924,no,BOA GOSTEIKKKKKKKKKKKKKKKK
925,yes,Karen vai lavar a louca q ta suja
926,no,E  CHORO  CONTINUA SENDO LIVRE
927,no,Bem vinda ao maior e melhor clube do planeta
928,no,Intao se vc nao ganhar nd e pk e ruim msm
929,yes,Ta com cara de quem peida na farofa kkkkkkk
930,no,Esta enganado 
931,no,voce esta desinformado
932,no,Ele foi sincero Corram atras
933,no,Falou o cara que nao sai da pagina verde
934,no,o choro e livre
935,yes,aprende a escrever cavalo 
936,no,vc e chacota bi da b sem mundial kkk
937,yes,mais um sem mundial bi da b lesma verde  kkkkk
938,yes,Nossa Anselma bibona invejosa sem criatividade
939,yes,Essa mina tem cara de cavalo 
940,yes,Ricardo tem cara de cavalo mas e uma potranca
941,no,O empresario desse rapaz e simplesmente magico
942,no,Seja feliz
943,no,Venda casada 
944,no,Que otima noticia para a massa atleticana
